{
  "scale_out": "ib",
  "span_mode": "local",
  "span_rtt_us": 2.5,
  "span_bw_gbps": 800.0,
  "span_failure_domain": "hall-a",
  "slice_rect": {
    "hall_id": "hall-a",
    "origin": [
      0,
      0,
      0
    ],
    "extent": [
      8,
      8,
      8
    ]
  },
  "stitch_id": "none",
  "stitch_api": "-",
  "topology_hash": "b7c2000000000000000000000000000000000000000000000000000000000000",
  "measured_il_db": 6.0,
  "measured_ber": 1e-12,
  "checkpoint_window_s": 120.0,
  "collective_window_s": 300.0,
  "ingest_budget_GBps": 40.0,
  "thermal_headroom_k": 3.0,
  "ride_through_s": 180.0,
  "power_headroom_kw": 250.0,
  "compile_cache_key": "b6323b045e7d34f0226324adef96541cf131a303837bb653eb19693bf7b8e3a2",
  "blast_radius": 1,
  "autonomy_level": "L1",
  "requested_action": "train",
  "measured_age_s": 30.0,
  "stitch_api_reachable": true,
  "labels": {
    "graph_hash": "a3f1000000000000000000000000000000000000000000000000000000000000",
    "cut": "dp"
  }
}
