{
  "scale_out": "metro_roadm",
  "span_mode": "span",
  "span_rtt_us": 2958.4,
  "span_bw_gbps": 800.0,
  "span_failure_domain": "regional-ring-north",
  "slice_rect": {
    "hall_id": "hall-a",
    "origin": [
      0,
      0,
      0
    ],
    "extent": [
      8,
      8,
      8
    ]
  },
  "stitch_id": "stitch-long-1",
  "stitch_api": "https://ocs.plant.example/v1",
  "topology_hash": "b7c2000000000000000000000000000000000000000000000000000000000000",
  "measured_il_db": 14.0,
  "measured_ber": 1e-12,
  "checkpoint_window_s": 120.0,
  "collective_window_s": 300.0,
  "ingest_budget_GBps": 40.0,
  "thermal_headroom_k": 3.0,
  "ride_through_s": 180.0,
  "power_headroom_kw": 250.0,
  "compile_cache_key": "da462ee8a6dff3ebcb302836013c64bb322119808b1e0d25a7b47973d3c249c7",
  "blast_radius": 1,
  "autonomy_level": "L1",
  "requested_action": "train",
  "measured_age_s": 30.0,
  "stitch_api_reachable": true,
  "labels": {
    "graph_hash": "a3f1000000000000000000000000000000000000000000000000000000000000",
    "cut": "pp"
  }
}
